INPUT:id	INPUT:text	GOLDEN:source
52	#МЧС #МЧСРОССИИ <br><br>Министр передал Главному управлению МЧС по Калининградской области новейшую пожарно-спасательную технику.<br><br>http://www.mchs.gov.ru/dop/info/smi/news/item/33391021/	mchsgov
53	#МЧС #МЧСРОССИИ <br><br>Более 23 тысяч сотрудников МЧС России будут обеспечивать безопасность мероприятий Кубка конфедераций FIFA 2017.<br><br>http://www.mchs.gov.ru/dop/info/smi/news/item/33236547/	mchsgov
54	На полигоне Брестский (Республика Беларусь) состоялась официальная церемония открытия совместного российско-белорусского тактического учения <br> <br>В ходе учения белорусские и российские десантники отработают вопросы ведения контрдиверсионных действий — обнаружение, блокирование и уничтожение отрядов условного незаконного вооруженного формирования. <br> <br>В практической части мероприятия принимают участие более 600 военнослужащих, задействовано около 100 единиц военной техники. От белорусской стороны в учении задействованы подразделения 38-й отдельной гвардейской десантно-штурмовой бригады, от российской — усиленная десантно-штурмовая рота Псковского соединения ВДВ общей численностью более 100 человек. <br> <br>#Минобороны #МеждународноеУчение #ВДВ	mil
55	В столице прошел чемпионат по автомобильному многоборью среди сотрудников полиции <br><br>В целях повышения уровня профессиональной подготовки личного состава ГУ МВД России по г. Москве состоялся командный чемпионат по автомобильному многоборью. <br> <br>В день открытия состязаний с приветственным словом к сотрудникам столичной полиции обратился заместитель начальника УРЛС ГУ МВД по г. Москве – начальник Управления профессиональной подготовки половник полиции Александр Гетманов: «Уважаемые коллеги, сегодня мы начинаем чемпионат Главного Управления МВД России по г. Москве по автомобильному многоборью. В ходе соревнований будут оценены подготовка личного состава, уровень профессиональной пригодности, индивидуальное мастерство как в управлении транспортным средством, так и в знании Правил дорожного движения, готовность выполнять оперативно служебные задачи. По результатам соревнований будет сформирована команда столичного главка для участия в чемпионате по автомобильному многоборью МВД России». <br> <br>В течение трех дней команды продемонстрировали знание Правил дорожного движения и свое мастерство в скоростном маневрировании на учебной трассе. Также в программе соревнований были представлены бег и стрельба из боевого оружия. <br> <br>Всего в чемпионате приняли участие сотрудники 14 московских подразделений полиции. <br> <br>После подведения итогов трехдневного соревнования судейская коллегия огласила список призеров и победителей. На торжественном закрытии чемпионата, которое состоялось 3 августа, лучшим представителям столичной полиции были вручены ценные призы и подарки. <br> <br>Победителями стали сотрудники УООП ГУ МВД России по г. Москве, второе место заняла команда УВД по САО, а третье – команда УГИБДД ГУ МВД России по г. Москве. <br> <br>Трехкратные победители московского чемпионата по многоборью Георгий Зуев и Александр Старовойтов уже в конце августа представят Москву на общероссийском уровне.<br><br>#МВДРоссии #Петровка38 #полиция #новости #чемпионат #многоборье	mospolice
56	На Северном флоте создан взвод исторической бронетехники. Это подразделение будет принимать участие в военных парадах, исторических реконструкциях и выставках, посвящённых Дням воинской славы России, а также в ряде государственных праздников по решению командующего Северным флотом. <br><br>Вошедшие в состав взвода танки ИС-3 и Т-34, а также «Шерман», поднятый с затонувшего транспорта «Томас Дональдсон» и полностью восстановленный специалистами ремонтно-восстановительного батальона СФ, уже принимали участие в военном параде, посвящённом Дню ВМФ на Приморской площади Североморска — и в исторической реконструкции боя на Форуме «Армия-2017». <br><br>Последним в строй исторической бронетехники вступил «истребитель танков» — противотанковая самоходная артустановка СУ-100, ремонт которой был завершён в начале осени.	mil
57	#МЧС #МЧСРОССИИ<br><br>Председатель Центрального совета ветеранов МЧС России Дмитрий Михайлик проголосовал на выборах Президента Российской Федерации вместе со своей семьей.<br><br>http://www.mchs.gov.ru/dop/info/smi/news/item/33577605/	mchsgov
58	Бомбардировщики дальней авиации Ту-22М3 нанесли удар по объектам боевиков ИГИЛ <br> <br>18 ноября 2017 г. шесть дальних бомбардировщиков Ту-22М3 нанесли авиационный удар по объектам террористической группировки ИГИЛ в районе города Абу-Кемаль (провинция Дэйр-эз-Зор). Над территорией Сирии авиационное прикрытие бомбардировщиков выполняли истребители Су-30СМ, базирующиеся на авиабазе Хмеймим. <br><br>В результате удара были уничтожены скопление живой силы, техники и вооружения террористов. <br><br>Уничтожение всех назначенных целей подтверждено средствами объективного контроля, который осуществлялся с помощью специальных технических средств. <br><br>После выполнения боевого задания российские самолеты вернулись на аэродромы базирования.	mil
59	Международный день защиты детей у нас круглый год!	mchsgov
60	#СИРИЯ <br>Российская авиационная группа и постоянно действующее соединение ВМФ в Средиземном море продолжают оказывать поддержку сирийским войскам в ходе наступательной операции по разгрому плацдарма ИГИЛ в долине реки Евфрат. <br> <br>В течение последней недели развернутой в Сирии многоуровневой системой разведки Минобороны России вскрыты наиболее важные объекты ИГИЛ в провинции ДЕЙР-ЭЗ-ЗОР. <br> <br>Это командные пункты террористов, крупные склады оружия и боеприпасов и ангары с бронетехникой ИГИЛ в районе населенного пункта МЕЯДИН. <br> <br>Для поражения данных объектов, сегодня из акватории Средиземного моря подводными лодками Черноморского флота «Великий Новгород» и «Колпино» были нанесены два залповых удара крылатыми ракетами морского базирования «Калибр». <br> <br>Удары по объектам международных террористов в районе города МЕЯДИН нанесены в целях поддержки успешных наступательных действий сирийской армии по разгрому плацдарма ИГИЛ в провинции ДЕЙР-ЭЗ-ЗОР. <br> <br>Пуски 10 крылатых ракет произведены из подводного положения. <br> <br>Средствами объективного контроля подтверждено уничтожение всех назначенных целей. <br> <br>Группировке ИГИЛ в районе населенного пункта МЕЯДИН нанесен существенный урон, как в живой силе, так и технике.	mil
61	В начале следующей недели на учебно-тренировочном комплексе ВВО в Хабаровском крае стартует окружной этап конкурса «Военно-медицинская эстафета». <br> <br>В ходе состязания военные медики должны в кратчайшие сроки обнаружить условно раненого, наложить ему кровоостанавливающий жгут, оттащить в безопасное место, наложить первичную давящую повязку и вынести с поля боя. На дистанции присутствуют естественные преграды и искусственные препятствия — завалы, воронки, проходы в инженерных заграждениях и колючей проволоке, моделирующие реальную ситуацию в условиях боя. <br> <br>Кроме того, механики-водители продемонстрируют свои навыки в вождении многоцелевых легкобронированных тягачей на пересеченной местности. <br> <br>#Минобороны #ВВО #АРМИ #ВоенноМедицинскаяЭстафета	mil
62	День передовых технологий и инноваций в МЧС России<br><br>На выставке будут представлены современные образцы робототехнических средств, комплексы беспилотных летательных аппаратов, оснащение аэромобильной группировки. Спасатели развернут образцы городков жизнеобеспечения, применяемых при реагировании на различные ЧС.<br><br>http://www.mchs.gov.ru/dop/info/smi/news/item/5932140/	mchsgov
63	ЖЗЛ<br><br>Первым человеком, который попал на марку Великобритании и при этом не был «королевских кровей» стал Уильям Шекспир. Кстати, марки с его изображением очень быстро раскупили. Только малая часть ушла по назначению	russianpost
64	Министр обороны России поздравил военнослужащих и ветеранов с Днем инженерных войск <br><br>ПРИКАЗ <br> <br>МИНИСТРА ОБОРОНЫ РОССИЙСКОЙ ФЕДЕРАЦИИ <br> <br>18 января 2018 г. № 7 <br> <br>г. Москва <br> <br>Товарищи солдаты и матросы, сержанты и старшины, прапорщики, мичманы, офицеры! <br> <br>Уважаемые ученые, конструкторы, работники оборонной промышленности! <br> <br>Дорогие ветераны! <br> <br>21 января в Вооруженных Силах Российской Федерации отмечается День инженерных войск. <br> <br>Верные своему долгу и присяге, военные инженеры всегда отличались героизмом, мужеством и самоотверженностью. <br> <br>Осуществляя инженерное обеспечение боевых действий, создавая необходимые условия для их успешного ведения, личный состав войск во все времена способствовал укреплению оборонного потенциала Отечества. <br> <br>Сегодня военные инженеры достойно продолжают традиции, заложенные предшественниками, успешно осваивают сложную современную технику, совершенствуют профессиональную подготовку, эффективно решают поставленные задачи. <br> <br>Готовность сил и средств инженерных войск постоянно подтверждается при выполнении мероприятий по предупреждению и ликвидации последствий аварий, катастроф и стихийных бедствий не только в России, но и за ее пределами. <br> <br>Принимая участие в восстановлении социальной инфраструктуры, разминировании освобожденной от ИГИЛ территории Сирийской Арабской Республики, военные инженеры заслужили искреннюю благодарность и уважение сирийского народа. <br> <br>МИНИСТР ОБОРОНЫ РОССИЙСКОЙ ФЕДЕРАЦИИ <br> <br>генерал армии <br> <br>С. Шойгу	mil
65	На западе столицы стартовало мероприятие «Снова в школу!» <br><br>Госавтоинспекция Западного административного округа г. Москвы примет участие в проведении общегородского профилактического мероприятия по предупреждению детского дорожно-транспортного травматизма «Снова в школу», которое приурочено к началу нового учебного года и продлится с 21 августа по 08 сентября 2017 года. <br> <br>Основными целями мероприятия являются напоминание детям о навыках безопасного поведения на дороге, их адаптация к сложным дорожным условиям, предупреждение несчастных случаев с детьми на улицах и дорогах города в период завершения школьных каникул и начала нового учебного года, повышение безопасности дорожного движения у школ и детских дошкольных учреждений, а также в местах массового нахождения детей, проведение разъяснительной работы среди участников дорожного движения по вопросам соблюдения Правил дорожного движения. <br> <br>В День знаний сотрудники ГИБДД будут обеспечивать безопасность дорожного движения у школ, примут участие в проведении школьных линеек и родительских собраний, на которых напомнят о необходимости соблюдения Правил дорожного движения и алгоритм безопасного движения по пути из дома в школу и обратно. <br> <br>Сотрудники Госавтоинспекции напоминают родителям о том, что дети берут пример с взрослых, поэтому необходимо на собственном примере воспитывать грамотных участников дорожного движения: учить детей правильно и безопасно переходить дорогу, не позволять им выходить на дорогу из-за стоящего транспорта (автобуса, троллейбуса, легковых машин и тд), помнить о светоотражателях на одежде ребенка, делающих его заметным на дороге. <br> <br>Уважаемые водители! Многие дети за период летних каникул отвыкли от городских дорог. Будьте предельно внимательными на дороге, особенно при проезде школ, остановок общественного транспорта, пешеходных переходов, парков, скверов, детских площадок и при движении в внутридворовой территории! Помните, что перевозить маленьких пассажиров в возрасте младше 7 лет, необходимо с использованием детских удерживающих систем (устройств), соответствующих весу и росту ребенка. Не забывайте пристегиваться сами и пристегивать ребенка каждый раз, когда отправляетесь с ним в поездку на автомобиле!<br><br>#МВДРоссии #Петровка38 #полиция #новости #безопасность #дети #СноваВШколу	mospolice
66	Друзья, у нас в группе заработала интерактивная вкладка «Путь посылки»<br><br>Посмотрите, какие этапы обработки проходит посылка от отправителя к получателю! Узнайте, какие пункты посещает международное отправление, в отличие от внутреннего, и наоборот. Кроме того, у вас появилась возможность отследить свое отправление по трек-номеру, не заходя на сайт.<br><br>Мы делаем все возможное, чтобы вам было удобней пользоваться сервисами Почты России.<br><br>https://vk.com/app4568878?from_install=2	russianpost
67	Пара танков Т-72Б мотострелкового подразделения #ЮВО на полигоне «Аданак»	mil
68	Напоминаем, что с 1 июля 2015 года существует важное правило: в темное время суток при нахождении вне населенных пунктов пешеходы должны иметь при себе специальные световозвращающие элементы (фликеры). Совсем недавно Почта России вместе с ГИБДД провела акцию «Засветись-Защитись!» для школьников Нижнего Новгорода, чтобы научить самых маленьких пешеходов заботиться о своей безопасности на дороге. Ребята познакомились с важной информацией о правилах дорожного движения, а затем приняли участие в квесте «Прогулка по безопасному городу”: попробовали себя в роли пешехода и водителя, искали с помощью фонарика фликеры в темной комнате, отвечали на вопросы викторины и даже изобрели новый знак дорожного движения.<br><br>Все участники акции получили в подарок фликеры, а также свидетельство участника акции, дающее право быть консультантом по безопасности на дороге для своих друзей и одноклассников. Приобрести фликеры различных видов можно в любом почтовом отделении, берегите себя и своих близких!<br><br>#ПочтаРоссии #НижнийНовгород	russianpost
69	"Друзья, вот и подошел к концу розыгрыш открыток, выпущенных для театрального фестиваля ""Золотая маска 2017""! Мы внимательно изучили ваши творческие работы и сегодня готовы объявить имена счастливых победителей!<br><br>Итак, открытки получают: [id19536746|Лешка Бармин], [id16652358|Алина Лукьянченко], [id21142980|Ксю Белова], [id201167808|Захар Ремизов], [id20094035|Олеся Муллина], [id5236472|Shooter Павлик], [id9488364|Анюта Карнаухова], [id61803389|Анастасия Кравченко], [id317879253|Юлия Дмитриева], [id99632731|Мария Галкина], [id132317225|Ася Петрова], [id90594766|Світлана Іванівна] и [id14932059|Ежатина Нуменорская]. От всей души поздравляем вас с победой, совсем скоро мы уточним в личных сообщениях адреса и отправим открытки! До встречи в новых конкурсах!<br><br>#ПочтаРоссии #РежиссерМоёПризвание #посткроссинг #postcrossing #открытки #postcards"	russianpost
70	Нас уже 20 000! Спасибо, что вы с нами! <br> <br>#МВД #Петровка38 #полиция #подписчики #вконтакте	mospolice
71	Тренировка «верных друзей» 470-го учебного центра служебного собаководства в Подмосковье<br><br>#Минобороны #Кинологи #ВерныйДруг	mil
72	Арктические образцы вооружения и военной техники на ночной тренировке к Параду Победы-2017<br><br>#Минобороны #ПарадПобеды2017 #Арктика #ОружиеРоссии	mil
