INPUT:id	INPUT:text	GOLDEN:source
89	Бывший сотрудник банка подозревается в хищении около 3 млн рублей у пожилой супружеской пары <br><br>Сотрудники уголовного розыска ОМВД России по району Чертаново Северное задержали бывшего сотрудника банка по подозрению в краже крупной суммы денег у супругов-пенсионеров. <br> <br>В ОМВД России по району Чертаново Северное обратился представитель одного из финансовых учреждений с сообщением о пропаже около 3 млн рублей со счетов 89-летнего клиента и его 84-летней супруги. <br> <br>В ходе проверочных и оперативно-разыскных мероприятий установлено, что к краже причастен экс-сотрудник банка, 26-летний житель столицы. Молодой человек был задержан. <br> <br>Оказалось, что злоумышленник воспользовался служебным положением и перевел сбережения клиентов банка на другие счета. <br> <br>Следствием ОМВД России по району Чертаново Северное возбуждено уголовное дело по признакам состава преступления, предусмотренного ч. 4 ст. 158 УК РФ «Кража». В отношении подозреваемого избрана мера пресечения в виде подписки о невыезде.<br><br>#МВД #Петровка38 #полиция #Москва #новости #банк #пенсионеры	mospolice
90	Онлайн-трансляция Спортивного Парада московской полиции <br><br>На южной спортивной арене олимпийского комплекса «Лужники» продолжается Спортивный Парад московской полиции, посвященный Дню сотрудника органов внутренних дел. <br> <br>Гости праздника, который распахнул свои двери для всех желающих, наблюдают за показательными выступлениями сотрудников спецподразделений полиции.<br><br>Смотреть: https://77.мвд.рф/прямая-трансляция-спортивного-праздника<br><br>#МВД #Петровка38 #полиция #новости #лужники #спорт #праздник #онлайн	mospolice
91	Тренировочный полет самолёта дальнего радиолокационного обнаружения и управления ВТА России А-50У	mil
92	#МаленькаяСпасеннаяЖизнь #МЧС #МЧСРОССИИ <br> <br>Огнеборцы отдельного пожарного поста села Чигири Амурской области спасли из глубокого колодца щенка алабая. <br>За помощью к спасателям обратилась жительница села. В колодец, который расположен в конце огорода, упала собака. Животное сильно скулило. <br>Спасатели спустились в колодец, глубиной около трех метров, и обвязали собаку веревкой. Двое других пожарных осторожно подняли, как оказалось, щенка алабая из колодца.	mchsgov
93	#СМИобМЧС <br><br>В беду может попасть каждый, но не каждый придет на помощь. Эти люди не побоялись рискнуть жизнью ради тех, кто оказался в опасности. <br><br>https://www.youtube.com/watch?v=ZxI_oSLNJwc	mchsgov
94	На западе Москвы задержаны подозреваемые в разбойном нападении <br><br>Сотрудники уголовного розыска ОМВД России по району Можайский задержали двоих 25-летних москвичей, подозреваемых в разбойном нападении. <br> <br>В территориальный отдел полиции поступило сообщение от 65-летней жительницы Москвы о том, что на ее супруга напали и нанесли ему два ножевых ранения. <br> <br>Как установлено, мужчина шел на работу, когда незнакомец попросил у него сигарету. Потерпевший ответил, что не курит, и продолжил путь. Через несколько метров к нему подошел другой незнакомый молодой человек и неожиданно ударил его. После этого подозреваемые дважды ударили мужчину предположительно ножом. Схватив сумку заявителя с документами и кошельком с денежными средствами, они скрылись. <br> <br>В ходе оперативно-разыскных мероприятий подозреваемые был задержаны. <br> <br>По данному факту возбуждено уголовное дело по признакам преступления, предусмотренного ст. 162 УК РФ «Разбой». Злоумышленники задержаны в порядке ст. 91 УПК РФ. <br> <br>Сотрудники УВД по ЗАО обращаются ко всем гражданам, пострадавшим от противоправных действий задержанных, с просьбой звонить по телефону: (499) 233-91-00 или в службу «102» (с мобильных телефонов – 112).<br><br>#МВД #Петровка38 #полиция #новости #можайский #разбой	mospolice
95	Привет, студент! Идешь завтра на День межнационального студенческого единства в ДВФУ в городе Владивосток? Тогда у нас для тебя предложение, от которого ты не сможешь отказаться!<br><br>Приходи на стенд Почты России на Ярмарке народов, делай фото и загружай в ВК или Instagram с одним из хэштегов: #ПочтаРоссии_ДМСЕ2017 или #russianpost_ISUD2017. Выполнив это условие, ты сможешь выбрать одну из нескольких крутых открыток с символикой Ежегодного студенческого фестиваля в ДВФУ и отправить её в любой уголок земли. Притом совершенно бесплатно!<br><br>Кроме того, на нашем стенде можно приобрести открытки с изображением Дальнего Востока и отправить их родным и близким из самого сердца фестиваля.<br><br>Приходи 24 ноября в ДВФУ (корпус S, 3 уровень), г. Владивосток на праздник и отправляй открытки Почтой России по всему миру! Торопись, количество открыток ограничено!<br><br>#ПочтаРоссии #ДМСЕ2017 #Владивосток	russianpost
96	#ПамяткаМЧС #МЧС #МЧСРОССИИ <br><br>Особенности управления автомобилем в тумане.	mchsgov
97	Смотрите прямую трансляцию с полей VII Московской конференции по международной безопасности #MCIS2018 на сайте Минобороны России http://mil.ru/mcis/live.htm	mil
98	Поздравление первого заместителя Министра внутренних дел Российской Федерации А.В. Горового с Днем ГИБДД МВД России <br><br>Уважаемые коллеги, друзья! Дорогие ветераны! <br>3 июля Государственная инспекция безопасности дорожного движения отмечает 81-ю годовщину со дня основания. <br>История службы богата примерами самоотверженности, героизма, верности долгу. Решая сложные и ответственные задачи, сотрудники Госавтоинспекции обеспечивают безопасное движение на автомагистралях страны, оперативно реагируя на изменение обстановки. Жизнь и здоровье людей на дорогах сегодня во многом зависят от ваших безупречных действий. <br>За последнее время общими усилиями органов государственной власти и общественных институтов удалось переломить ситуацию с аварийностью, сохранив тем самым тысячи человеческих, в том числе детских жизней. <br>Впереди у Госавтоинспекции путь дальнейшего совершенствования и развития. Каждому сотруднику в любой ситуации важно помнить, что самое главное – это люди, на страже законных интересов которых мы стоим. Убежден, что личный состав подразделений Госавтоинспекции будет и впредь защищать законные права и интересы всех участников дорожного движения, оберегать жизнь и здоровье наших граждан. <br>В этот день отдельную благодарность хотел бы выразить ветеранам Госавтоинспекции за тот вклад, который они вносят в воспитание молодых сотрудников, и неоценимую помощь в решении стоящих перед службой задач. <br>Сердечно поздравляю сотрудников Госавтоинспекции, ветеранов с профессиональным праздником, желаю новых успехов, выдержки и терпения в вашей непростой работе, благополучия вам и вашим близким! <br>#деньгибдд #полиция #мвд #полицияроссии #мвдроссии #гибдд #россия #police #russianpolice #russia	mospolice
99	В Западном округе Москвы прошел межрайонный конкурс по безопасности дорожного движения «Юный велосипедист»<br><br>На базе станции юных талантов «Солнцево» прошел межрайонный конкурс по безопасности дорожного движения «Юный велосипедист» среди учащихся школ районов Внуково, Солнцево и Ново-Переделкино Западного округа города Москвы. Данное мероприятие приурочено к весенним школьным каникулам и проводилось в целях профилактики детского дорожно-транспортного травматизма с участием детей.<br><br>В нелегкой борьбе юным участникам конкурса предстояло проявить себя на различных этапах соревнований. На 1 станции «Знатоки ПДД» надо было сдать экзамен на компьютере по Правилам дорожного движения, на 2 станции «Оказание первой медицинской помощи» – уметь быстро и грамотно оказать первую доврачебную помощь, на 3 станции «Фигурное вождение» – показать индивидуальное виртуозное владение велосипедом, преодолев сложную полосу препятствий. А на 4 станции «Основы безопасности жизнедеятельности» каждую команду ждал командный теоретический экзамен на знание основ безопасного поведения на дороге.<br><br>Подробности: http://petrovka38.ru/news/item/7525005/	mospolice
100	Команда 2 оперативного полка стала победителем чемпионата по стрельбе из пистолета Макарова <br><br>В Центре профессиональной подготовки ГУ МВД России по г. Москве прошел чемпионат столичной полиции по стрельбе из пистолета Макарова. В состязаниях приняли участие более 100 полицейских из 59 команд. <br> <br>Участникам соревнований стали руководители и заместители управлений столичного гарнизона. Им было необходимо с 25 метров в течение 10 минут совершить 10 зачетных выстрелов, на основании которых подсчитывается результат. <br> <br>«Более 15 лет я принимаю участие в подобных чемпионатах, как представитель команды от своего Управления. Считаю, что как руководитель обязана подавать пример подчиненным. На состязаниях царит непередаваемый дух соперничества и чувство большой ответственности за результат команды», - отметила начальник УДиР ГУ МВД России по г. Москве полковник внутренней службы Лариса Пантелеева. <br> <br>По окончании чемпионата лучшим стрелком в личном зачете среди мужчин стал полковник полиции Домашев Владимир – командир 2-го ОПП ГУ МВД России по г. Москве. Среди женщин первенство завоевала полковник внутренней службы Пантелеева Лариса – начальник УДиР ГУ МВД России по г. Москве. В общекомандном зачете первое место получила команда 2-й ОПП ГУ МВД России по г. Москве, второе место УГИБДД ГУ МВД России по г. Москве и третье место досталось команде ЦПП ГУ им. С.Х. Зайцева ГУ МВД России по г. Москве.<br><br>#МВД #Петровка38 #полиция #новости #стрельба #чемпионат	mospolice
101	19 ноября 1711 года недалеко от села Холмогоры в Архангельской области родился Михаил Ломоносов – будущий ученый, энциклопедист, естествоиспытатель, светило мировой и отечественной науки. Михаил Васильевич прожил 53 года, успев сделать ряд потрясающих открытий в разнообразных областях знаний – от минералогии до опто-механики. <br><br>В честь Ломоносова неоднократно выпускались советские почтовые марки, а мы покажем вам ту, что вышла три года назад, на 300-летие со дня рождения великого ученого.	russianpost
102	#МЧС #МЧСРОССИИ <br><br>Водолазы МЧС России и скалолазы в сложных условиях проводят поисково-спасательные работы на руднике «Мир» в круглосуточном режиме.<br><br>http://www.mchs.gov.ru/dop/info/smi/news/item/33297083/	mchsgov
103	Большие противолодочные корабли Тихоокеанского флота на учении поразили артиллерией сложные цели на побережье <br><br>БПК «Адмирал Трибуц» и «Адмирал Виноградов» в районе одного из морских десантных полигонов флота, действуя в составе отряда кораблей огневой поддержки, провели артиллерийскую стрельбу в ходе которой уничтожили невидимые береговые цели, в числе которых имитированные долговременные огневые точки и техника условного противника. <br> <br>Кроме того, экипажи отработали задачи по организации противоподводно-диверсионной обороны при стоянке на незащищенном рейде с выполнением профилактического гранатометания.<br><br>#ВМФ #ТОФ #БПК #БоеваяПодготовка #Корабли #Артиллерия #Учения	mil
104	Друзья, хотим напомнить, что на странице нашей группы работает калькулятор сроков доставки почтовых отправлений: https://vk.com/app4944085_-49069650.<br>Чтобы узнать, сколько дней ваше письмо или посылка будет в пути, не обязательно звонить на горячую линию. <br><br>Запустите приложение, укажите вид отправления, выберите название и тип населенных пунктов отправителя и адресата. Система рассчитает вам нормативные сроки доставки, исходя из официальных правил. Это тот срок, на который вы можете ориентироваться при пересылке вашего отправления внутри страны.<br>#ПочтаРоссии #услугипочты	russianpost
105	Подготовка механизированной колонны Хабаровского гарнизона к Параду Победы, посвященному 73-й годовщине Победы советского народа в Великой Отечественной войне <br> <br>#Минобороны #ВВО #ВОВ #ПарадПобеды	mil
106	#МЧС #МЧСРОССИИ <br><br>Сибирский региональный центр МЧС России будет применять авиацию для мониторинга ледовой обстановки на водоемах и обеспечения безопасности населения. <br><br>http://www.mchs.gov.ru/dop/info/smi/news/item/33479198/	mchsgov
107	#МЧС #МЧСРОССИИ<br><br>Авиация МЧС России получит 12 самолетов Бе-200ЧС до 2025 года.<br><br>http://www.mchs.gov.ru/dop/info/smi/news/item/33345610/	mchsgov
108	Вышел новый номер газеты «Петровка,38» от 29 ноября 2016 года. <br><br>#МВД #Петровка38 #полиция #новости #газета #сми	mospolice
109	В те далекие времена, когда почту доставляли ямщики и курьерские тройки, появилось исключительно русское явление – звонкий поддужный колокольчик. Его звон символизировал приближение новостей и весточек. Он обязывал всех путников уступать дорогу почтовой тройке, а целая индустрия умельцев поставляла звонкие колокола небольшого размера для конных упряжей. <br><br>Идея быстро понравилась народу, и использовать мелодичный звон стали простые обыватели. Почтовый департамент ревностно отнёсся к распространению этого символа, и 18 декабря 1836 года вышло постановление Сената, в котором говорилось: «Запретить употребление колокольчиков всем тем, которые едут на собственных или вольнонаемных лошадях, предоставив оные одной почтовой гоньбе и чиновникам земской полиции, едущим по обязанностям службы».<br><br>Кстати, почтовые колокольчики настолько прочно вошли в русскую культуру, что даже нашли свое отражение в литературе. Например, вот что о них писал Александр Сергеевич Пушкин в поэме «Граф Нулин»: <br><br>«Кто долго жил в глуши печальной,<br>Друзья, тот верно знает сам,<br>Как сильно колокольчик дальный<br>Порой волнует сердце нам».	russianpost
110	#МЧС #МЧСРОССИИ<br><br>Подведены итоги конкурса «Юный корреспондент» IX Всероссийского фестиваля «Созвездие мужества»: победительницами стали Владислава Осисорова и Софья Серкова из г. Воркуты Республики Коми.<br><br>http://www.mchs.gov.ru/dop/info/smi/news/item/33432526/	mchsgov
111	20 мая 2018 года в России проводится Единый день велопарадов. <br><br>В Москве состоится традиционный Большой Московский велопарад, который пройдет по Садовому кольцу..<br><br>В этом году групповой проезд полицейских будет посвящен 300-летию российской полиции.<br><br>Если вы хотите принять участие в Большом Московском велопараде – приглашаем вас с родными и друзьями на велосипедах в нашу команду!<br><br>Велопарад – не гонка, в нём можно участвовать людям с разной подготовкой, даже детям. Важно, чтобы нас было много! Хорошее настроение гарантируем!<br><br>Сбор участников – с 10.00 до 11.00 в сквере напротив фабрики «Большевичка». Напоминаем, что в день велопарада провоз велосипедов в электричках бесплатен.<br><br>#police #mvdrussia #МВД #мвдроссии #полиция #полицияроссии #мвд77 #петровка38 #новости #велопарад #московскийвелопарад #велосипед #мероприятие #праздник	russianpost
