INPUT:id	INPUT:text	GOLDEN:source
126	В Останкинском районе юным жителям вручили их первые паспорта<br><br>В преддверии Дня защитника Отечества в отделе МВД России по району Останкинский состоялась торжественная церемония вручения паспорта гражданина Российской Федерации 14-летним юношам. <br> <br>В праздничной обстановке под Гимн Российской Федерации начальник ОМВД России по району Останкинский капитан полиции Сергей Гладышев совместно с начальником отделения по вопросам миграции ОМВД России по району Останкинский капитаном полиции Романом Гордеевым вручили подросткам важные в их жизни документы. Руководители обратили внимание на необходимость бережного обращения с паспортом гражданина Российской Федерации и рассказали ребятам об их новых правах и обязанностях. <br> <br>Также полицейские отметили, что получение паспорта – это очень важное и торжественное событие в жизни молодых людей. Для подрастающего поколения – это первый серьезный шаг во взрослую жизнь. <br> <br>Поздравив ребят с Днем защитника Отечества, полицейские вручили им памятные подарки с символикой российского флага. Торжественная церемония завершилась совместным фотографированием.<br><br>#police #mvdrussia #МВД #мвдроссии #полиция #полицияроссии #мвд77 #петровка38 #новости #паспорт	mospolice
127	На Курилах расчеты артиллерийских установок «Гиацинт» и экипажи танков Т-72Б пулеметно-артиллерийского соединения #ВВО в ходе тактико-специального учения выполнили огневое прикрытие войск в обороне <br> <br>Кроме того, в рамках учения связисты #ВВО провели тренировки по развертыванию современных аппаратных и станций, организовали связь с использованием открытых, закрытых и спутниковых каналов связи между абонентами в условиях применения противником средств РЭБ. <br> <br>В ходе активной части учения на Сахалине и Курилах военные инженеры установили минные поля и организовали оборону береговой линии от высадки морского десанта условного противника.	mil
128	Сотрудники столичной полиции задержали подозреваемую в торговле ребенком <br><br>В Южном округе Москвы ходе оперативно-разыскных мероприятий была задержана 63-летняя уроженка Средней Азии, пытавшаяся продать 5-ти месячного ребенка за 120 тысяч рублей. В качестве покупателей выступили сотрудники правоохранительных органов, которые и задержали подозреваемую.<br><br>Подробности: https://petrovka38.ru/news/item/7847748/<br><br>#петровка38 #новости #ребенок #торговля	mospolice
129	#БудниМЧС #МЧС #МЧСРОССИИ <br><br>Семейные ценности. <br>Фото: Виктория Улубикова	mchsgov
130	"#БудниМЧС #МЧС #МЧСРОССИИ <br><br>Преданный взгляд. <br>На фото Алексей Бочкарев и самая опытная собака в питомнике отряда ""Центроспас"", лабрадор-ретривер Берни. <br><br>Фото: Ксения Колесникова/РГ"	mchsgov
131	Сотрудники ОНК Западного округа провели профилактическую беседу с родителями школьников<br><br>Сотрудники полиции провели разъяснительную беседу с родителями учащихся старших классов средней общеобразовательной школы № 571 с целью профилактики и предупреждения наркомании среди несовершеннолетних. <br> <br>Начальник отделения профилактики административной практики и противодействию наркопритонов ОНК УВД по ЗАО подполковник полиции Сергей Фирсов рассказал собравшимся о вреде наркотических и психотропных веществ, озвучил статистику преступлений в сфере незаконного оборота наркотиков и рассказал об уголовной и административной ответственности за противоправные деяния данной направленности. Кроме того, в ходе беседы были приведены примеры из практики. <br> <br>Полицейские также сообщили слушателям о негативном и необратимом влиянии наркотиков на мозг и организм человека и о последующих тяжких последствиях в результате их употребления. <br> <br>Также Сергей Фирсов акцентировал внимание собравшихся на предусмотренной законом ответственности за хранение, распространение и употребление наркотиков. <br> <br>Подобные мероприятия проводятся сотрудниками УВД по Западному округу на постоянной основе.<br><br>#police #mvdrussia #МВД #мвдроссии #полиция #полицияроссии #мвд77 #петровка38 #новости #ОНК #наркотики #ЗАО	mospolice
132	Следствие Западного округа столицы возбудило уголовное дело по факту мошенничества <br><br>https://youtu.be/uMNBU1kRw6Y<br><br>#МВДРоссии #Петровка38 #полиция #новости #мошенничество	mospolice
133	Доброе утро! Хорошего дня и успешной рабочей недели!<br><br>Фото: УВД по ЗелАО ГУ МВД России по г. Москве	mospolice
134	Развитие рынка подписки в России требует совместных усилий.<br><br>Именно этой теме было посвящено заседание «Альянса в поддержку института подписки на газеты и журналы», проведенное на днях совместно с Почтой России. <br><br>В качестве решения проблемы были озвучены предложения по проведению рекламных кампаний в поддержку подписки на страницах разных изданий, также было предложено комплектовать школьные библиотеки периодическими печатными изданиями. <br><br>Эти и другие способы развития российского рынка подписки вошли в резолюцию Альянса в поддержку института подписки на газеты и журналы.<br><br>#новости@russianpost	russianpost
135	В общевойсковую армию ВВО на территории Амурской, Еврейской автономной областей и Хабаровского края поступила партия бронетранспортеров БТР-80. Техникой будут укомплектованы инженерно-саперные подразделения. <br> <br>БТР-80 – боевая колесная плавающая машина, предназначенная для быстрой переброски подразделений к месту выполнения задач, поддержке их огнем из штатного вооружения и ведения боя из машины. Машина вооружена башенным крупнокалиберным 14,5-мм пулеметом КПВТ и спаренным с ним 7,62-мм пулеметом ПКТ.	mil
136	Около 1300 военнослужащих и 25 единиц современной военной техники приняли участие в параде Победы в городе Белогорск Амурской области <br> <br>Впервые в параде одна рота военнослужащих участвовала в современной экипировке «Ратник». <br> <br>В пешем строю прошли военнослужащие в амуниции времен войны, за которыми проследовали войска гарнизона. Второй год в параде участвовали военнослужащие-женщины, а также представители движения «Юнармия» и кадеты городских школ. <br> <br>Механизированную колонну возглавлял современный бронеавтомобиль - внедорожник «Тигр» и группа бронетранспортеров БТР-80 со знаменем Победы. Кроме того, в строю техники проследовали боевые машины пехоты БМП-2 и танки Т-72Б3. Вслед за боевыми машинами прошли противотанковые средства «Конкурс» и «Штурм-С». Продолжили колонну военной техники артиллерийские системы «Акация» и «Гиацинт», реактивные системы залпового огня «Град» и «Ураган», а также зенитные ракетные комплексы «Оса» и «Бук». <br> <br>#Минобороны #ВВО #ВОВ #ПарадПобеды #ДеньПобеды #9мая	mil
137	Розыск пропавших без вести Марковой Аллы Владимировны, Буткус Анастасии Рудольфовны и Буткус Маргариты Рудольфовны <br> <br>ОМВД России по Войковскому району разыскивает пропавшую без вести Маркову Аллу Владимировну, 25.02.1977 года рождения, уроженку Приморского края, которая 11 ноября этого года ушла из дома, забрав с собой несовершеннолетних детей: Буткус Анастасию Рудольфовну, 29.09.2007 года рождения и Буткус Маргариту Рудольфовну, 04.10.2010 года рождения. В настоящее время на связь они не выходят. <br> <br>Приметы Марковой А.В.: на вид 25-30 лет, рост 160-174 см, худощавого телосложения, лицо европейского типа, глаза зеленые, волосы прямые светлые. <br> <br>Приметы Буткус А.Р.: на вид 9 лет, рост 160 см, худощавого телосложения, лицо европейского типа, глаза голубые, волнистые темно-русые волосы. <br> <br>Приметы Буткус М.Р.: на вид 6 лет, рост 160 см, худощавого телосложения, лицо европейского типа, глаза голубые, волосы прямые, светло-русые. <br> <br>Полиция просит всех, кому что-либо известно о местонахождении разыскиваемой, сообщить по телефонам: (495) 601-00-08 или в службу «102» (с мобильных телефонов – 112). <br> <br>#МВД #Петровка38 #полиция #новости #розыск #внимание	mospolice
138	В 1929 году Михаил Зощенко опубликовал книгу «Письма к писателю». В ней он собрал и прокомментировал более полусотни читательских посланий. Ему писали много, ведь юмористический жанр всегда привлекает большое количество поклонников. К сожалению, противников у таких произведений тоже хватало. Зощенко был непредвзят и включил в книгу критические и острые письма наравне с хвалебными отзывами. <br><br>Автор старался отвечать даже на самые странные письма, параллельно читал труды по психологии и боролся с приступами хандры. Сам Зощенко признавал, что это было необходимо для написания новой книги, «не такой, как «Сентиментальные рассказы», жизнерадостной, полной любви к человеку». «Письма к писателю», поставившие Зощенко перед необходимостью читать и отвечать на корреспонденцию, оказались своеобразным упражнением и тренировкой.<br><br>#почтавлитературе #письма	russianpost
139	Сегодня во время визита в Россию Президент Республики Сербии Александр Вучич посетил Академический ансамбль песни и пляски Российской Армии имени А.В.Александрова<br><br>#Минобороны #МеждународнаяДеятельность	mil
140	Экипажи ударных вертолетов Ка-52, Ми-24 и Ми-8АМТШ Западного военного округа на учении в Псковской области поразили свыше 100 мишеней, имитирующих колонны боевой техники и самолеты на аэродромах условного противника <br> <br>На этапе практических действий летчики выполнили задания одиночно и в составе звеньев с боевыми пусками управляемого и неуправляемого ракетного, бомбового и пушечного вооружения. <br> <br>Помимо этого, экипажи боевых машин осуществили задачи огневой поддержки мотострелковых и танковых подразделений, ведущих маневренный бой с превосходящими силами условного противника. <br> <br>#Минобороны #ЗВО #Ка52 #Ми24 #Ми8АМТШ	mil
141	Министр обороны России поздравил сотрудников и ветеранов Главного управления Генерального штаба с профессиональным праздником — Днем военного разведчика<br><br>Выступая перед сотрудниками Главного управления Генерального штаба Вооруженных Сил РФ в преддверии Дня военного разведчика Министр обороны заявил, что военные разведчики обеспечили успешную работу Воздушно-космических сил в ходе операции в Сирии.<br> <br>Он сообщил, что сегодня шесть самолетов Ту-22М3 нанесли очередные удары по объектам террористов в Сирии, подчеркнув, что успешный результат во многом обеспечен и действиями военных разведчиков. <br> <br>«Это лишь маленькая часть той работы, которую сегодня ведет военная разведка. И мы вам благодарны, признательны за это», – отметил Министр обороны. <br> <br>Министр обороны привел такой красноречивый факт – за проявленное мужество почти 750 сотрудников военной разведки удостоены высоких званий Героя Советского Союза» и Героя России, тысячи награждены орденами и медалями. <br> <br>Отдельные слова признательности и благодарности глава военного ведомства адресовал ветеранам военной разведки. <br> <br>«И я сегодня еще раз хочу пожелать вам здоровья, берегите себя, вы нужны нам, нужны стране, нам нужен ваш опыт», – заключил глава военного ведомства.	mil
142	Предстанут перед судом участники сообщества, занимавшиеся сбытом героина на территории России <br><br>«ГСУ столичной полиции окончено производством и направлено в суд уголовное дело по обвинению пятерых граждан в организации сообщества и участии в нем, а также в совершении преступлений, связанных с незаконным оборотом героина в особо крупном размере на территории Российской Федерации», – сообщил начальник Управления информации и общественных связей ГУ МВД России по г. Москве Александр Князев.<br><br>Подробности: https://77.мвд.рф/news/item/9029905<br><br>#МВД #Петровка38 #полиция #новости #наркотики	mospolice
143	Расчеты ЗРПК «Панцирь» #ВВО впервые выполнили сопровождение и уничтожение низколетящих воздушных целей из автоматических пушек на удалении 1200 метров на общевойсковом полигоне в Хабаровском крае <br> <br>Кроме того, личный состав зенитно-ракетного подразделения на новых комплексах совершил 400 километровый марш в район выполнения боевых стрельб.	mil
144	"Испанский художник Висенте Ромеро Редондо закончил школу искусств ""Сан-Фернандо"" в 1982 году. Он работает в стиле неореализма и большинство его полотен – гимн красоте и романтике. Вот одна из его картин."	russianpost
145	В Бутырском районе Москвы обнаружен арсенал оружия<br><br>Бригада рабочих при строительстве водопровода на Новодмитровской улице во время раскопки труб канализации наткнулась на боевой артиллерийский снаряд.<br><br>Подробнее: https://petrovka38.ru/news/item/7876443<br><br>#петровка38 #новости #арсенал #оружие	mospolice
146	Переброска бойцов арктической мотострелковой бригады СФ на армейском снегоходе А-1 во время проверки боеготовности подразделений в Мурманской области <br> <br>#Минобороны #СФ #Арктика	mil
147	Сотрудники полиции установили местонахождение пропавшего без вести мужчины<br><br>Сотрудниками полиции установлено местонахождение пропавшего без вести Седова Юрия Ивановича, который 10 декабря 2017 года ушел из дома и не вернулся. <br> <br>В полицию с заявлением о розыске страдающего расстройством памяти 53-летнего жителя Зеленограда, обратились родственники. Как выяснилось, накануне мужчина вышел из кваритры и его не могли найти. <br> <br>На розыск без вести пропавшего были ориентированы наружные службы полиции. Сотрудниками уголовного розыска УВД по Зеленоградскому АО проведен ряд оперативно-розыскных мероприятий. <br> <br>Сегодня на станции метро Тушинская г. Москвы пропавший без вести Юрий Седов был обнаружен. Сотрудник пресс-службы УВД по Зеленоградскому АО лейтенант внутренней службы Марина Абрамова находилась в свободное от службы время около автобусной остановки, расположенной в проезде Стратонавтов г. Москвы. Заметив мужчину, приметы которого были размещены в средствах массовой информации, как пропавшего без вести, офицер полиции незамедлительно сообщила об этом коллегам - инициаторам розыска. <br> <br>При взаимодействии с волонтерами одной из общественных организаций сотрудниками отдела уголовного розыска мужчина был доставлен в территориальный отдел полиции СЗАО г. Москвы. Мужчине оказали первую помощь, а затем он был госпитализирован в столичную больницу. Сотрудники полиции сообщили заявителям о том, что их родственник найден.<br><br>#police #mvdrussia #МВД #мвдроссии #полиция #полицияроссии #мвд77 #петровка38 #розыск	mospolice
